,Datetime,Tweet Id,Text,Username
206,2021-10-04 00:20:37+00:00,1444819714241404929,last night one of my friends was driving us to a thing and playing trip hop in the car and my other friend called it “lesbian music” and I immediately felt like I have always been oblivious to the truths of this world. haven’t stopped thinking about it since,detritusmaze
207,2021-10-04 00:19:32+00:00,1444819440718254082,she's been incredible since the beginning https://t.co/zj3sNh31L4,kwangyaiu
208,2021-10-04 00:05:20+00:00,1444815867171139585,"@bryfiles since actually when,,, all of ur branding has the lesbian flag colors EVERYWHERE? i’m confused n kinda disappointed in these yahoos’ reading comprehension /lh",calwilderr
209,2021-10-03 23:50:14+00:00,1444812066963873792,@dwtprivs bc if you're attracted to nonmen as a whole then that makes lesbian by default an mspec compatible identity since nonmen consists of multiple different genders and mspec attraction is defined by attraction to more than one gender,queercryptidRey
210,2021-10-03 23:42:57+00:00,1444810233864392712,"i did not know all the context since i don't have tt but also if you have a big account....
still wrong on my part because as someone who suffers from severe comphet i should have seen it but without any proper context it just looked like a sapphic calling theirselves a lesbian. https://t.co/vCIFnT1PNR",xcquace
211,2021-10-03 23:40:42+00:00,1444809668589654017,for crona its bc ive interpreted them as being gay transmasc since i was 13 and im not giving that up for anything and for link well i just think he and zelda are gay lesbian best friends,RadioactiveAcid
212,2021-10-03 23:32:44+00:00,1444807663452360706,"@h_umanhunter @fluidsbian No..

By saying that lesbians can feel attraction to men doesn't mean men can go into lesbian spaces.

I don't know why you're holding onto the strawman so hard.

Also does this mean that non-binary people who strictly love non-binary people can't identify as lesbians, since by-",DcCrasherLGBTQ
213,2021-10-03 23:31:45+00:00,1444807414545477638,"I hate that I went through this.....

This morning, I was heading to Walgreens with my wife. Usually I take my Prius but since it's needing repairs, I took my girlfriend's car...which happens to be a former Crown Vic Police Interceptor. Well I'm going down the road, at most (1/3)",transgirlinSEA
214,2021-10-03 22:59:05+00:00,1444799195584421889,"kdj feels bad for the wolf and decides to bring it into his cottage, not knowing that said wolf would refuse to leave him alone afterwards.

when it seemed like the wolf was starting to heal, kdj wanted to let it go, since he knew that animals didn’t like to feel trapped.",oldestreader
215,2021-10-03 22:56:26+00:00,1444798528535019522,"Alright alright… since so many people have asked about #mlpgen5 merch already, I’m watching the #MyLittlePonyANewGeneration movie. I hope that one that looks like a lesbian is a lesbian. You can mute #LesbianPonyWatch if you don’t wanna hear my live tweet thoughts lmao https://t.co/e6mUKeLUFp",Eevachu
216,2021-10-03 22:56:04+00:00,1444798432573632519,"@albedoscum @Mrsdykey from what i've read, the lesbian flag was made first, not really known since the lipstick flag was still a thing, and then was the toothpaste flag",eihpleb
217,2021-10-03 22:48:30+00:00,1444796530439905280,@lesbianclown np!! i do think op should think twice before posting something like this though but i can't speak for their experience since trauma is personal and complex and i'm not a lesbian,oddhauntings
218,2021-10-03 22:39:16+00:00,1444794207516962817,"I knew about gay people since birth seeing as a lesbian couple have been very heavily involved in my life

I found out about bi people when I was about 16

Trans people when I was 17

Can't remember the rest

I'm 25 https://t.co/b6B97ONj7M",leetxdd
219,2021-10-03 22:30:55+00:00,1444792103771557892,im not coming from a lesbian or bi perspective here btw since i don’t currently label myself but rather just as someone who knows what crushes and attraction feels like,frutadesol
220,2021-10-03 22:24:12+00:00,1444790415765475331,so since crush plays cat lady i guess my bunny is gonna be a lesbian 😌,Levicopter
221,2021-10-03 22:21:52+00:00,1444789826054770689,"for the nonbinary flag, nothing, I love it. But for the 2 lesbians flags I tend to use...well, I'd wish the fully pink flag would srop being associated with the lipstick lesbian one since it was reclaimed, and the sunset one to not be associated with its 2nd creator  :/// https://t.co/QoSZRA96f8",GL0SSMYLARG0
222,2021-10-03 22:19:17+00:00,1444789178429022213,"i hate neurotypical cishet girls so badly because theyre like thinkning i cant do makeup because im apparently seen as a tomboy lesbian to them, and since the teacher told the class i have autism theyve been sickly sweet to me https://t.co/IsENGuoyUB",choppogore
223,2021-10-03 22:13:42+00:00,1444787772334739462,"@looking4evah @sassygayroot Yeah, I don't remember exactly the episode she says it. Probably 1 or 2, but Sophie tells Finley she doesn't know what a good marriage looks like since her dad left right after Maribel was born",lesrabbithole
224,2021-10-03 22:01:29+00:00,1444784696563482628,@lysseden yeah that’s like a major component thanks to a lack of inability to concentrate!! i haven’t finished a book since 2016 lol,cumdropbutton
225,2021-10-03 21:56:39+00:00,1444783482555838465,since the internet decided “let people do what makes them happy!!!” the internet has also forgotten that people are allowed to dislike things,cumdropbutton
226,2021-10-03 21:52:48+00:00,1444782511456980996,"@FizzySoda_ I'm not getting a boyfriend since I'm a Lesbian. But I have been trying to get a girlfriend for a few months now, which hasn't been working •-•",MidnighttheDrox
227,2021-10-03 21:51:39+00:00,1444782221873790976,Than jin would be last since he would help me accept myself more and feel happy with myself and not bad about myself since i am trans and demi aro ace lesbian and i wouldnt have bad thoughts about this anymore since of him,promisedwonder
228,2021-10-03 21:40:38+00:00,1444779451733118984,"@MsSweetTD @JohnJamesTV @BevJacksonAuth @ALLIANCELGB Yes. She (a fucking lesbian) was calling out a harmful, insipid theory. She knew she was doing so. She was not homophobic, though queer theory is, since it denies same sex attraction is based on, you know, sex.",EdwinDroom
229,2021-10-03 21:37:39+00:00,1444778701661556739,"@feministpenguin So if I'm agender and only like other agender people, that makes me gay and lesbian. Def can't be bi since I only like one gender",ChaceTheyAce
230,2021-10-03 21:35:45+00:00,1444778223162703874,"my friends made me take it and i thought i was gonna get chuuya since all i know about him is that hes an angry lesbian but here we are

I just got result 'Nikolai Gogol' on quiz 'Your Bungou Stray Dogs kin '. What will you get? https://t.co/R2QyaW1mgh via @uquiz",b43_t
231,2021-10-03 21:17:12+00:00,1444773553883209741,well i always suspected it but after reading the masterdoc i just felt understood and since so much of it resonated with me i think it kind of confirmed my suspicions https://t.co/8rBp3MAwXi,glamorousjjk
232,2021-10-03 21:05:59+00:00,1444770730093301763,"I learned to shoot when I was around her age because my grandfather wanted me to be able to protect myself and know how to properly handle a gun in case I ever had to. Haven't gone shooting ever since, yet every bit of knowledge stuck with me and I feel safer because of it. https://t.co/m5eGBehVW1",fandomfem
233,2021-10-03 21:04:05+00:00,1444770252395618312,"@UntoNuggan heard the f slur and t slur constantly since i was a kid + various other anti gay insults from my own family because my cousin wanted to play with dolls when we were small.

mum used to joke about having a lesbian fling with her best friend

had teachers make queerphobic remarks",discretelyobvs
234,2021-10-03 21:02:26+00:00,1444769835746041857,I say this as the overall state of balance not in reference to specific mechanics since that has a lot more variation (like rn moris/keys are balanced way more for survivors),strawberykitty
235,2021-10-03 20:51:10+00:00,1444767000492789760,I’ve had one lesbian encounter since being in pdx ( will be three years in feb I’ve been here ) and it ended how most of them do in total heartbreak and now they aren’t in my life anymore,Renakaya0424
236,2021-10-03 20:35:59+00:00,1444763182011019266,woke up at noon and ive done absolutely nothing since but i have hw to go do now so bye bye ig ☹️🙏🏼,lesbianIorde
237,2021-10-03 20:29:39+00:00,1444761589052231684,"@gwencystic normally I'd @ my gf here so she could confirm, but since she's off of twitter, y'all are just gonna have to trust my word",Tankgorl
238,2021-10-03 20:29:20+00:00,1444761508710342664,kaeya has srsly had beef with amber since she was like FOURTEEN. he is a grown man,sharkprn
239,2021-10-03 20:19:47+00:00,1444759105068019713,"@Lewd_Despair More blushing. . . 

“ Yeah, confidence's gonna be an issue. . . I mean, if it'll just be us two, it probably ain't gonna be so bad! Since we're friends and all. . . ”",QxeenOfSwxmmxng
240,2021-10-03 20:14:20+00:00,1444757733232758788,@angelsmanifesto sam and mercedes should’ve been endgame since i hc quinn as a lesbian i don’t ship her with any men like at that point she could’ve ended up single and it would’ve made sense.,GabbyyyBee
241,2021-10-03 20:13:04+00:00,1444757415988285441,"#HearthGuild 

Application time
Oh boy we are doing this

Hii I'm Dusk, I'm a nonbinary lesbian

I'm mainly an Xbox and Switch gamer so my cross compatibility ain't the best but I promise I'm cool

I've been playing minecraft since I was 7 and Games since like 2

thats it I guess",NoContextDusk
242,2021-10-03 19:57:32+00:00,1444753505269522438,"Also I am bi/bi lesbian, so even when I “was” a cis man, I was subject to biphobia &amp; even made a victim of violence &amp; harassment for it.

Whilst also being closeted trans &amp; having to deal with intense dysphoric feelings since 17 years old.",Brietannia
243,2021-10-03 19:49:41+00:00,1444751530230493185,"@NeoPagliacci &gt;you are still a lesbian if a trans woman tops you

Outside of a BDSM context, since when do lesbians talk about how they ""top"" one another?",squirrelwheel
244,2021-10-03 19:41:36+00:00,1444749495233830914,@lightyagaemi Omg that's so good it's been a while since I last eat it and now I'm craving it,notmental8
245,2021-10-03 19:34:15+00:00,1444747645986217985,"@BOmnicide It unlocks gay dialogue options and allows you do deal 10% damage to men.

There's also straight options and a lesbian version of the perk.

However, since most of the common enemies are male, 'gamers' pick the perk for the damage boost even though it makes the MC gay",Markymis
246,2021-10-03 19:14:47+00:00,1444742747982794757,@ilyfleming i can’t ship ellie with any man since i’ve learned that she was supposed to be a lesbian — and least of all with alec…. i love their friendship too much,blueboxd
247,2021-10-03 19:13:54+00:00,1444742526322286595,"@2Kaitlouise4 @strwbryfemme I always found it funny how it was the ""lesbian"" that was in quotation marks and not the ""mspec"", since you know, most aren't attracted to men.",straightbian
248,2021-10-03 18:52:18+00:00,1444737087782232067,Really proud to say that my girlfriend hasn’t worn Dickies since before the pandemic.,merkelley
249,2021-10-03 18:51:25+00:00,1444736865433686017,Possibly Thanatos trying to redirect Ares’ attention for Nyx on himself since Nyx is a huge lesbian and she started to get annoyed with Ares. Jokes on Thanatos again since Ares was just trying to get closer to Thanatos this whole time. Anyways Ares has the best orgasm of his life,serdechno
250,2021-10-03 18:40:15+00:00,1444734056671989764,"@RealDJCthulhu The original Gay and Lesbian Liberation groups has since long also voiced strong dislike of the term. When I came out ~20 years ago English-speakers told me it was largely offensive and outdated and to rather use gay, conservatives love their outrage culture a lot lmao",alligatoraliens
251,2021-10-03 18:39:33+00:00,1444733881719029761,@Target wants to hear from you about the 190% increase in peeping Tom incidents against women since they implemented their new mixed sex changing room policy. https://t.co/ZybTt9OVU3,LesbianOwl33
252,2021-10-03 18:38:55+00:00,1444733722260082696,"27. One of Ashley's Foster carers taught her how to fix cars, since he was a car engineer.... Unfortunately this was around the time Ashley started figuring out she was a lesbian, and the man's wife was homophobic... So Ashley went back to Foster care...",sasbodyguard
253,2021-10-03 18:37:24+00:00,1444733338116370437,ever since the frost performance…… can’t stop thinking about demon hyuka taunting yeonjun,LesbianTaehyun
254,2021-10-03 18:35:16+00:00,1444732803132895241,"@WonderShaw_ Yeahhh that bit was so cute. I adored it and I love the fact that she was a lesbian. The pride stuff was a great place to start the game. I didnt want to take everything down! 

I smiled like an idiot when Alex appeared! Since I knew what was coming",Fred_Burkle
255,2021-10-03 18:16:39+00:00,1444728117764009998,@realhomomarcus I identify myself best as a member of the human race and a lesbian since I care so deeply for all of my sisters too.,RayArnold_VVA
256,2021-10-03 18:14:37+00:00,1444727606855745543,"@synthishere @chheinzel @LibPosting rehabilitation works both ways, and since she has shown no signs of having truly abandoned her alt right values (also that anti-trans video she made a few weeks back), makes me think she's not changed at all. Once she shows progress, I'll be happy to support it, but not now.",Tankgorl
257,2021-10-03 18:13:25+00:00,1444727304429596677,"they want to privatize water. and since there's no rain anymore i guess it'll be easier than when they tried that in bolivia, since they won't need to smash people's faces for putting pots on their roofs",bitterkarella
258,2021-10-03 18:12:30+00:00,1444727071473815553,"@chheinzel @LibPosting @synthishere pre-fucking-cisely

if she at least rebuked those actions and said she was wrong about those, I'd be more willing to give her the benefit of the doubt, but since she outright denies those more egregious events I do not trust her in the slightest that she's changed",Tankgorl
259,2021-10-03 18:05:20+00:00,1444725268824870914,@toothpasteantis damn I've never seen a canon she/they user💔💔💔but since they're mspec you can pass them on to @favshetheybi,theyshenanigans
260,2021-10-03 17:55:00+00:00,1444722668457144323,"@UntoNuggan We have always had queer community since I can remember, although I did grow up in the informal lesbian capitol of the country. It was positive, although I saw that out in the world that wasn't the case (gen x).",niais
261,2021-10-03 17:51:44+00:00,1444721845152981000,"@kellyclarkson Janet's not alone in that sentiment. I've watched you since American Idol and I remember someone asking me ""Are you a lesbian or something"" because I thought you were simply amazing. Can't we just love someone without homophobic comments being made?",TransTimesDaily
262,2021-10-03 17:50:55+00:00,1444721641573916674,"I haven't ID'ed as a lesbian for a number of years since my orientation has settled firmly in the bi part of the spectrum.

So, this is beyond the scope of my involvement at this point.

But, yeah. Push back, y'all. Do what you can.",timberwraith
263,2021-10-03 17:48:46+00:00,1444721100768878597,@Unhappy_lesbian Been diagnosed since I was a small child. Definitely qualify :),SomewhereFar_0
264,2021-10-03 17:40:52+00:00,1444719112777871361,"Spilt my coffee on myself, it hurt since it was still pretty hot and it was right on my skin 😭",LesbianCloyster
265,2021-10-03 17:39:37+00:00,1444718796011360256,"Check your sell-by date, ladies. Faux-lesbian kissing hasn’t been taboo since 1994.",bot_riverdale
266,2021-10-03 17:38:32+00:00,1444718525915049987,me buying lesbian pride earrings knowing im basically never gna wear them since the only time i leave the house is to visit family and to go to school :((,GinSaysMeow
267,2021-10-03 17:31:04+00:00,1444716645457580038,many ppl thought i was a lesbian ever since i used she/her 😭 ah well doesn’t bother me maybe i should be more specific,1974showtime
268,2021-10-03 17:23:19+00:00,1444714695743746048,Think I probably just have to accept I'm bi at this point which is particularly weird since I formed a lot of my identity around being specifically a lesbian,Poppayyyyyy
269,2021-10-03 17:21:36+00:00,1444714262191030277,"@DivineNoodles i find it funny at times since i can definitely relate to the feeling of using a colour/theme moreso incidentally or for shallow reasons rather than anything in-depth, but at the same time i can't help but wonder if it just spawned more Fight Club dudebro-esque media consumption",akorinkolesbian
270,2021-10-03 17:16:52+00:00,1444713072514506756,"I think I'm going to go with White Smoke since it looks so delightfully Gothic.

And based on this list, maybe I'll finally check out Rebecca for my next read

""Where to Start Reading Lesbian Gothic – The Lesbrary"" https://t.co/xbmhYflkpM",schomj
271,2021-10-03 17:14:04+00:00,1444712367980519426,"This week in 1942, for the first time since the war begun, the Allies produce more shipping tonnage than the Germans are able to sink,. 
At the same time for the month of September, the Allies manage to sink 1/3rd of supplies headed to Rommel.

https://t.co/C7J40dqXT1",Tankgorl
272,2021-10-03 17:01:18+00:00,1444709153797251080,"@megabus @HannahntheWolf @twattisphere I ended up having to take a Memphis city bus to the Greyhound station and buy another bus ticket ($100) to get the rest of the way to Kentucky.
Since then I've warned everyone I know not to use Megabus. 4/4",shinyslowqueen
273,2021-10-03 17:00:31+00:00,1444708957356969991,"Probably going to start a gofundme for a new car since my parents reversed their support for me getting a new car, because a ""temporary"" fix means now the car can last another 2 years.",MarxistOni
274,2021-10-03 16:53:18+00:00,1444707140321566721,"guys omg im having kind of a sexuality crisis. when i was in middle school i said i was bi but it was just because of comphet, so at the end of middle school/start of highschool i labelled myself as a lesbian and I've been sure of it since the last period of time",blamsupremacy
275,2021-10-03 16:45:57+00:00,1444705292814589956,"i've got a cosplay prepared for halloween
i'm crossing my fingers since i want these pictures to be perfect lmao",WRAllTH
276,2021-10-03 16:35:34+00:00,1444702679117217794,"i think since it will be a serquel/ralicia one? 
but idk if anyone is up for a lesbian fanfic so please let me know i’ve never done this lol https://t.co/hsPjIHVQop",itzisparrilla
277,2021-10-03 16:27:31+00:00,1444700653985611776,"@QueenFreddieB Also, cops are going to naturally relate to whoever shares an identity with them. Since they were white men, they felt white man Brian was relatable and trustworthy.",JOANNACEwriter
278,2021-10-03 15:51:37+00:00,1444691618246938625,Lesbian! I don’t think it’s changed to much since I’m Afab https://t.co/UsiqIvByd1,Art227Neonink
279,2021-10-03 15:49:44+00:00,1444691144596725760,@UntoNuggan I was under 5? My mom's best friend and my godmother is lesbian and they worked together when I was born. I think since I'm '97 I'm technically an older gen z.,tee_spoonie
280,2021-10-03 15:45:23+00:00,1444690048725643268,Im a lesbian and I don't mind being called tomboy pero di ko sure kung sila rin. it takes time rin kasi ako nga SHS ko nalaman na lesbian pala ako 😭 I guess wag natin silang pilitin sa term na hindi nila gusto? Since magkaiba naman ang meaning.,pichie26
281,2021-10-03 15:02:03+00:00,1444679145234083844,Help I was watching movie with my parents and I accidentally said that girl is pretty hot and my dad just out of no where asked me if I’m lesbian and since I’m bisexual and still in the closet I started to freaking out and I said no and I left the room,QuanetriaA
282,2021-10-03 14:25:15+00:00,1444669884064018437,@razuberiru Honkai impact is gonna have a hard time since they’re a lot of lesbian relationship in it,Memelin_sequel
283,2021-10-03 14:16:18+00:00,1444667629885607940,"WELL! Since they're actually fine, I'll try to watch it this week! I know the girls don't get together but my little lesbian heart is too enticed not to watch it",Raviolliess
284,2021-10-03 14:13:22+00:00,1444666893663494152,@norottingfruit yeah ibe been doing this since 4am i feel like a fucking lunatic,strssfl
285,2021-10-03 13:51:35+00:00,1444661409464209410,ok so revons not in jail as far as i know. her last post on insta was in may so 4 months after negotiated bail but no updates from the photographer friend since then,strssfl
286,2021-10-03 13:45:20+00:00,1444659836109549573,because prior to her serving time she was an active friend that was featured in a lot of posts and there have been no updates about her since,strssfl
287,2021-10-03 13:45:19+00:00,1444659833571975168,"based on the original photographers last post about her, it seems like revon has been in jail since dec and won’t able to negotiate release till jan 2021 and based on the original photographers most recent posts it might suggest that she is still in jail or they had a falling out https://t.co/hPrDrW861R",strssfl
288,2021-10-03 13:31:43+00:00,1444656410000859138,"@CrettersS @bunnojooni @commiesgood You can't be lesbian and be attracted to men. So no, mspec lesbians aren't valid since they invalidate lesbians and bisexuals",IupicaIz
289,2021-10-03 13:00:41+00:00,1444648600055730183,i've been pretty much identifying as a lesbian since 2015 or 2016 but used different terms inbetween https://t.co/bZIkLR7g1C,naetles
290,2021-10-03 12:57:46+00:00,1444647866664902665,and my brother doesn't know that she is a lesbian. i think i am the only one that knows since she told me. but also he doesn't think she is straight https://t.co/MADxIGehqS,fetchmesometea
291,2021-10-03 12:44:22+00:00,1444644494402490370,"Tbh I would like to pull for Hu Tao since she’s the only character atm to have rings. And I’m a lesbian so I like rings I’m general. But hey, I need Xiao and Albedo rerun. I’ll just get Thoma and dip 🙏❤️‍🔥",SleepyLei
292,2021-10-03 12:18:14+00:00,1444637917046054913,OK woodaba here im gonna do a quick stream in a little bit BUT a new development has occured since the schedule...I could do the LESBIAN ROAD TRIP rpg as planned...OR i could KILL CHAOS in the new demo for FF Origins...the choice is yours....,RadicalHeartz
293,2021-10-03 11:11:53+00:00,1444621220427689984,"beb i'm looking for new mutual to enliven my dry timeline since i just started a new life. i speak both eng and bhs. please leave a trace and don't forget to check your following list, tia! https://t.co/JiUqkRsGMP",YURIBASERP
294,2021-10-03 11:11:11+00:00,1444621043092627462,"Azusa-san checked our compatibility, and it was 100%. I told her that's nice and all, but since we're the same gender, it doesn't mean very much. Next thing I knew, she was coming closer, looking at me with those eyes... I'm afraid that she's not joking,",lesbianricchan
295,2021-10-03 10:43:13+00:00,1444614006774267905,"@jerwinvillacruz we know what tomboy in the west means ofc. im a lesbian myself who is female presenting. in our community we call each other tomboy or tibo, just like how gay ppl reclaimed the word “bakla”. idk if u get that since u have nothing to reclaimed i guess https://t.co/kUzVTI04wz",grasyalav
296,2021-10-03 09:45:11+00:00,1444599400538460161,"Pep will be fully aware how Bingo will set the dips up looking for the hoof ball outlet to the Egyptian cheating bastard &amp; the usual VAR intervention ( John Aldridge is on it today)
The 2 cheats &amp; the lesbian front 3 are in decent form but we’ve not conceded since the opening day",ppowersleftfoot
297,2021-10-03 09:43:29+00:00,1444598973407322115,"There is no singular perspective of feminism so of course there will be women who disagree and think women should not be included, but since the 70s and the second wave, the majority of voices in mainstream feminism has not opposed women being included in the draft.",ImpoliteLesbian
298,2021-10-03 09:28:48+00:00,1444595277558652928,i made them when i was like 11 or 12 and was a cis lesbian so idk how to feel about it now since i am non-lesbian now,CRYSTALGENDER
299,2021-10-03 09:26:42+00:00,1444594751404187651,@ranboosfavnby yea! that is exactly my reason!! I also feel like it could invalidate the bi person if I say we are in a lesbian relationship since they are not a lesbian,Unhappy_lesbian
300,2021-10-03 09:25:09+00:00,1444594362151751685,"@Unhappy_lesbian yeah! because if you're a lesbian but in a sapphic relationship with some who's not, it's not technically a lesbian relationship since you're not both lesbians. am i making sense /gen",ranboosfavnby
301,2021-10-03 09:18:22+00:00,1444592651873959937,@septicflxwer MITSKI REACTIVATED TWITTER AND INSTAGRAM AFTER BEING ON HIATUS SINCE 2018 IM LOSING MY MIND,mandoilovethoma
302,2021-10-03 08:28:52+00:00,1444580195688660994,"@irlultimateluck Given that lesbian community and culture have included mspec lesbians since the identity was first adopted, what’s not clicking is why people who aren’t biphobic or transphobic would deny that mspec lesbians exist.",tharook
303,2021-10-03 08:14:25+00:00,1444576560715993093,serious question for my black lesbian moots: is it okay for non black lesbians to reclaim the d slur? ever since i watched a tiktok of someone saying that it's only for black lesbians to reclaim i haven't said it (except when it's a lyric) should i just stop using it entirely??,sapphicrdellini
