,Datetime,Tweet Id,Text,Username
708,2021-09-30 10:18:07+00:00,1443520524550877185,"@RCollumbell @Jebadoo2 It is odd that it is ""controversial"" to be gay or lesbian and say so in 2021 - 50+ years since decriminalisation, and 40+ years since I was picketing WH Smith over the shop's refusal to stock Gay News",TimBarnsley1
709,2021-09-30 10:11:09+00:00,1443518773366071297,"Azusa-san checked our compatibility, and it was 100%. I told her that's nice and all, but since we're the same gender, it doesn't mean very much. Next thing I knew, she was coming closer, looking at me with those eyes... I'm afraid that she's not joking,",lesbianricchan
710,2021-09-30 09:55:12+00:00,1443514758401966082,ACTUALLY since noelle canonically likes horror movies would she invite susie to watch old horror movies? Would they watch possibly in michigan together? W,turkey_korvid
711,2021-09-30 09:25:33+00:00,1443507298488492033,"@Xela_Eswor @communalsofa @NattytheBratty Regarding what you said about Libya, Iraq &amp; Syria, I will not deny that these were definitely done because of geopolitical goals of those involved, however since they were not done in cooperation with NATO nor got a majority of NATO members support you can't call them NATO ops.",Tankgorl
712,2021-09-30 09:21:55+00:00,1443506381349347329,"@Xela_Eswor @communalsofa @NattytheBratty Well, since you asked, infant mortality between 2001-2021 dropped by half, electricity availability went from 1 in 4 Afghans in 2001 to almost everyone in 2021, and from almost no literate teen girls in 2001 went to 1 in 3 teen girls being literate in 2021.",Tankgorl
713,2021-09-30 09:15:12+00:00,1443504691829166082,YEAH I THOUGHT I WAS A LESBIAN SINCE LIKE....2nd grade.... https://t.co/wL7te6ykDJ,CAL1PORN
714,2021-09-30 07:40:25+00:00,1443480839917088773,Day 1: Favorite character: As far as NPCs go... this is tough. I love a lot of them... but I think when it comes down to it it's Alisaie Leveilleur. Her and her brother have grown so much since ARR and I love a sword lesbian. Her emotion in Shadowbringers especially got to me.,afflatusmiisery
715,2021-09-30 07:23:11+00:00,1443476502851502084,I had a #Carer/#SupportWorker and #friend from 2019 - 2020. We got on very well and shared a lot of the same #interests etc. But the minute she got a job #working for the #darkweb and turned #Lesbian she does not want to know me anymore and we have not been out since :( #Traitor,Billy_Davis91
716,2021-09-30 07:06:45+00:00,1443472368408535042,since y'all are so into korean shows rn then please watch kingdom if you haven't already,K00LESBIAN
717,2021-09-30 06:51:49+00:00,1443468608231944195,"@DisapproveI @MayGriffin64 @EmilyGorcenski Oh hell, you don’t have Trans Medical Care 101 with Mrs. Trainor do you? Between you and me she’s kind of a MILF but she had no patience for bullshit.

And since you’re late she’ll probably make you read her dissertation.",MadelineTraino1
718,2021-09-30 06:39:48+00:00,1443465584633651200,nako debut extremely young and got used to having kkura with her - they debut in izone and lost them togsther and now theyve been split for the first time since they met,minjuswife_
719,2021-09-30 06:35:04+00:00,1443464394143256577,@ZeDingo @dzcile @Mspec_Positive My advisor in college was in her 80's and had been an out bi lesbian since she was in college... As have I,Stanford_lands
720,2021-09-30 06:16:41+00:00,1443459767662305284,@MmeDeschamps I got this same critique!! I’ve since switched to third person but when it was in first I had several people tell me that Romada read like a man (she’s a lesbian pirate captain).,Charli_Bone
721,2021-09-30 05:46:33+00:00,1443452183756918786,"@MCharlie18 I mounted an American flag on my house a few weeks ago. I believe the left need to reclaim it from the increasingly traitorous right. 

But then I realized that I needed to do something to clarify (especially since a lesbian couple moved in next door) so I’ve got this to put up: https://t.co/G15GAd5gOe",shelley_thinks
722,2021-09-30 05:01:10+00:00,1443440761668882433,"@NoSun4Loki @StarOfAsgard ..a lesbian one in this example). Since lokis gender identity is constantly shifting the terms for the relationship would constantly shift,  thus a sexuality that includes this shift (I think e.g. abrosexual, or just go by queer) is a better term. I think you can see how.. [3]",anja_mch
723,2021-09-30 04:32:38+00:00,1443433583150960645,I’ve been watching this show since I was 12 which probably explains a lot about me as a person,capri_pants
724,2021-09-30 04:03:44+00:00,1443426308357242882,"@dnevsrachel i been knew im a lesbian since i was 7(big crush on j. biel), so i ve always known bout my love for girls; but i truly didnt realize it till 18 in berlin, durin my last high school trip. 
One night encounter with a german hotty, she looked at me and i was awestruck....",PvtGunnerHeath
725,2021-09-30 03:34:52+00:00,1443419045424926720,"@caramelfa1ry having adhd and autism means i have no idea what symptom is linked to what bc they do overlap a lot 😭 since they’re a comorbidity, some psychologists believe that they are different manifestations of the same condition, but i’m not entirely sure i believe that",lesbian_mothman
726,2021-09-30 03:34:06+00:00,1443418851983642625,One lesbian movie night later and we’ve been friends ever since 🥺💛 https://t.co/XVbPoRaHA3,96evenofpil
727,2021-09-30 03:15:39+00:00,1443414207483973636,@adorpheus ....I hate to be that person that looks like the more ‘problematic’ lesbian flag in the background. Had to double check with my gf since she makes lesbian pride edits all the time for herself.,OtherWitchery
728,2021-09-30 02:46:46+00:00,1443406941829492740,tiktok has been showing me a lot of lesbian content ever since i started listening to girl in red’s album,icyrichie
729,2021-09-30 02:42:57+00:00,1443405978100248589,"Check your sell-by date, ladies. Faux-lesbian kissing hasn’t been taboo since 1994.",bot_riverdale
730,2021-09-30 02:08:15+00:00,1443397246167523336,"Yall ever have an oomf since your early days on this app, and then they were big but got even bigger and they unfollowed you because they dont need you anymore and you just found out and now you're sad? Me too",LesbianLuxury
731,2021-09-30 01:59:39+00:00,1443395085064867848,"also theres another gay couple but its spoilers so i wont say anything but saying frill literally&amp;canonically created a lesbian commune isnt  spoilers since u dont know who she is til just before she makes them, so. theres a literal lesbian commune in this anime. god i love it",deadtowers
732,2021-09-30 01:52:34+00:00,1443393302007590914,"@Momo_minty_ bi = men and women. yea. of course. but since bi = MEN and women, there is no bi lesbian. do you. do you get it. do you understand. is this hurting your brain huh",circushorns
733,2021-09-30 01:48:47+00:00,1443392346591137800,another thing about me since i've gotten backhanded comments about it before but . i hc aether as a transfemme lesbian! that's the reason why i draw them with girls  . i don't particularly even care much for traveler ships in general though but jsyk,artofmimih
734,2021-09-30 01:46:41+00:00,1443391818285166595,"@rad_center @ethandthames @EmilyGorcenski The contradiction is only in your bigoted mind. The need for clarity about a stranger’s reproductive system, since you’re not her doctor, is invasive and awful and obscene. Leave her alone.",MadelineTraino1
735,2021-09-30 01:43:47+00:00,1443391089696772099,@circushorns I didn't say pan since that means all and doesn't care about gender like lesbian. I just mean mspec/bi as in attraction to more than one gender. Some lesbians are attracted to more then one gender so they are just as free to use mspec as a label too. I'm not talking about men,Momo_minty_
736,2021-09-30 01:37:07+00:00,1443389411358617601,"@DancingABC quick question since you're so woke.  

Why does a woman (JoJo) ask another woman ""which position is the DUDE""?  Does that sound like a gay woman?  Lesbian?  She's not gay.  Fake, fake, fake for publicity.  Another child hijacked.  It's sick.",PopNFood
737,2021-09-30 01:13:17+00:00,1443383415500427272,"@FlREHOSED never said anything, never brought it up. It would be too awkward. The 'getting to know each other' period had long since expired, so he just left it as it was. It wasn't a worry of not being accepted, Hen was openly a lesbian and everyone accepted her, because of course, but",FIREFlGHTERDIAZ
738,2021-09-30 00:44:51+00:00,1443376259061489667,hi :D welcome to autistic lesbian of the whatever !! here's an info thread since i dont wanna make a carrd lawlz https://t.co/Sux3wb9eaR,tohtnof_y
739,2021-09-30 00:42:27+00:00,1443375653194240004,"since a new cookie and bunch of events just came out, if anyone is newly starting ovenbreak or hasn't logged in for a month+... (bats my eyelashes) https://t.co/prka7vNdID",butchteddybear
740,2021-09-30 00:17:11+00:00,1443369298681077760,It’s been years since I seen her but being with her was always fun I wonder how she would feel to know that I’m a lesbian,asilverfairy
741,2021-09-30 00:11:46+00:00,1443367935079325696,"@3cho211 @Walroose64 depends on the person much of the time since there are a lot of reasons that exist for it
someone might id as an mspec lesbian because theyre a system/plural, because theyre biromantic but homosexual or bisexual and homoromantic, etc.
it can be complex",erikaispanlol
742,2021-09-30 00:05:21+00:00,1443366319240454151,ok Daniel Craig is my fave bond with Brosnan in a close second but Ive been ready to see who they pick for the next 007 since 2012 sooooo,Madasahxtter
743,2021-09-29 23:44:57+00:00,1443361183986339844,"now, we all hate political lesbianism for its racism, transphobia, and blatant lesbian erasure of actual lesbians (since this was lead by cishet yt women). butch and femme identities were not acknowledged by political lesbianism because,",cuddlephoria
744,2021-09-29 23:44:46+00:00,1443361136750080005,sometimes i cannot tell if im a Gay man or a lesbian which is very strange to me since those are quite basically the exact opposite of eachother,frerardgaysex
745,2021-09-29 23:28:02+00:00,1443356929418534915,"Hence her comment about ""not loving like that again"" she hasn't fully given her heart to anyone since Nat. But Dani has gotten into her heart without her even realizing. With anyone else, I think this could have been the beginning of the end for Gigi. But not with Dani.",lesrabbithole
746,2021-09-29 23:24:21+00:00,1443356000120156164,@neh_leeee 😂😂😂💔Chiyambi chawu Lesbian anyway since its 2021 and y'all cool with this bisexual thing ....,Pemphs1
747,2021-09-29 23:24:10+00:00,1443355953840205832,"Oh no, a male individual was barred from the female locker room? 

Since when do males have the right to impose upon us in spaces when we’re vulnerable based on their say-so? 

It’s absurd. He’ll be fine with the other males. https://t.co/cfO6paC5vY",WackyPidgeon
748,2021-09-29 23:15:02+00:00,1443353655390969859,"The genre, but I am interested if nostalgia causes a revival for my generation.

I've myself given thought to a satire at various points since hugh school.",Ren_Chandler4
749,2021-09-29 23:09:59+00:00,1443352387150811138,"Back to work for hopefully the last stretch, before we're overstuffed tomorrow since the end of the month is our busiest time.",JoWoCo
750,2021-09-29 22:51:41+00:00,1443347779326197767,"@stellarrsys @tranzpaprika @DABIWAP @meloncatz Male is a sex, not gender. I’m attracted to females, not gender (since yes it’s a social construct). Sounds like you’re the one that needs to read a book.",not_hella
751,2021-09-29 22:46:21+00:00,1443346437329145856,"@raishi8 @tomb8man But in our long long history, we have never legalized to slaughter or fire someone because she/he is lesbian or gay.  You were ugly murderers because you killed them until yesterday. We haven’t condemned same-sex love since the Middle Ages.",TitouUsagi
752,2021-09-29 22:40:41+00:00,1443345012788400128,"Since spooky season is upon us:

THINGS IN MY 2ND LESBIAN VICTORIAN #wip:

🍂 A pretty Medium
🍂Snark
🍂Murders in a seance 
🍂Questionable parlor games
🍂Dramatic mothers
🍂Ghosts
🍂Secret societies
🍂Did I mention snark
🍂Love

#amwriting #LGBTQ #romancenovel #WritingCommunity",Katie_Masters29
753,2021-09-29 22:33:43+00:00,1443343258978078727,"it makes me sad knowing that i won't ever really have a true friendship with a guy ever again lol. outside of my one male friend that i've been friends with since i was a kid, every guy i've met has expressed attraction to me one way or another :/",hawkesgf
754,2021-09-29 22:33:18+00:00,1443343153440952321,"did... did a psychologist i follow on instagram just say that since sexuality is “fluid” being, for example, a lesbian doesn’t mean you have to feel attraction exclusively for non men? and that people who realize this are “deconstructed”?",RUN1NSKITAY
755,2021-09-29 22:32:48+00:00,1443343026550681602,also its been two years since Skye passed. I miss him. He was such a sweet boy and i still love him sm. https://t.co/8p5TQkq7z2,lesbian_bug
756,2021-09-29 22:24:48+00:00,1443341013251145731,@Naddildeaux I am gonna look in to all of this! Im trying to be better to my skin since I am in my 30’s and want to keep it looking a little young haha.,motelsonthemoon
757,2021-09-29 22:24:38+00:00,1443340971194920962,@friendkomori this is funny to me since i follow your priv,pikuselu
758,2021-09-29 22:08:44+00:00,1443336971531730951,"Below are links to different articles about the similarities of gay men's brains to women's, &amp; lesbian's brains to men.
This all warrants a closer look &amp; further study. Especially since it's being used to override the reality of biological sex.",AmyGrayMythical
759,2021-09-29 22:07:35+00:00,1443336680639844352,"A Lil Info about s-sides:

- the s in s-sides stands for sin since this mod is basically fnf but everyone is a demon, it also stands for swag because the mod is extremely swag 
- s-sides gf is a lesbian, there will be no bf in the mod, just two girlfriends 
- MM design soon :)",cosmycosmo
760,2021-09-29 21:51:23+00:00,1443332604615344129,what’s up w the lack of (new) susahao fics on ao3 &lt;//3 tgaa has been out since july everyone’s had enough time to play dgs2. 🙄,phrogsju
761,2021-09-29 21:41:01+00:00,1443329994277543937,"since i don't want lewd of like default Buncha 

can i do a super horny daki of guy!Buncha?? is that allowed??? the lesbian is here to feed people interested in the bunny man",BunChata
762,2021-09-29 21:33:20+00:00,1443328062335045632,"@HCAcritics how does she think lgbtq+ representation in media changed ever since her last lesbian role on what's cooking (2000), a movie she did 21 years ago?",jnniferanistcn
763,2021-09-29 21:23:31+00:00,1443325590971506690,So since we now know that feedback works....let’s get mihoyo to apologize and fix their anti-black writing???,starrysketchz
764,2021-09-29 20:56:41+00:00,1443318840033783809,"pre middle school actually, i said i was bi so ppl would stfu. i been lesbian since grade 3 &amp; im in grade 11 so 8yrs https://t.co/2Sc8yrqQ45",gogygnf
765,2021-09-29 20:52:42+00:00,1443317838694002693,"@Oculus_Beats @miguel92996 @libsoftiktok Gay, lesbian, transgender and etc students are committing suicide in high numbers do to identity crisis and the world telling them that they aren't normal when they are, a kid since a young age being around transgender people doesn't make him transgender and that as been proven",KevRare
766,2021-09-29 20:44:29+00:00,1443315767072657415,"The entire plot was about how bruce had lost his humanity after the death of his son and how after seeing the destruction supes caused since mos left him with the impression that he was a dangerous alien rather than another person with a mom and fam, the curtain wasn't just blue!",lesbiantony
767,2021-09-29 20:44:28+00:00,1443315766015705090,i don’t rlly know bcs when i was little i was forced into these lesbian situations ? with my friend which i didn’t rlly wanna do but since then idk what i am https://t.co/fIAqRKrbQO,cumtober
768,2021-09-29 20:43:02+00:00,1443315404068331522,"My pastor called me the devil because back when I was maybe 14 I identified as a lesbian, he said my kind of people weren’t welcomed &amp; that god would never accept me. ever since then I stopped going to churches https://t.co/c6eloqta20",444XOAM
769,2021-09-29 20:42:54+00:00,1443315368949395458,@KimWilliams201 oh I know it's a good for me! but since a guy in a video has been telling me to drink water I now don't want to do it,Unhappy_lesbian
770,2021-09-29 20:36:23+00:00,1443313730863894534,"one time a cishet man was trynna tell me how lesbians where he’s from be outside shirtless. since he was telling ME (not a cis man) the story, he decided he needed to dance around the word “lesbian” 

“ah you know when um.. haha ya know, people with breasts be outside and um-” https://t.co/iGcCRfMuSJ",getthesurgery
771,2021-09-29 20:12:53+00:00,1443307817188962311,Gillian Anderson plays a lesbian teacher in what LA Times are calling 'The best queer film since Stranger by the Lake'.,LGBTFilmBot
772,2021-09-29 20:12:24+00:00,1443307693096177664,"@clubsapnap in 4th grade (i was either 7 or 8) i realized what a lesbian was since my friend had lesbian moms, allot of the ppl in my class found it strange and i never rlly understood why they felt that way? when i asked they said it wasnt ‘normal’ and that it was wierd.",t0bolive
773,2021-09-29 20:01:08+00:00,1443304858782781443,@clubsapnap ive known i was a lesbian since i was like 10 so like almost 7 years ago,gaycigarettes
774,2021-09-29 20:00:36+00:00,1443304723474489347,kaeya has srsly had beef with amber since she was like FOURTEEN. he is a grown man,sharkprn
775,2021-09-29 19:53:17+00:00,1443302883722776582,@poloxsaum She always had that lesbian energy in all her movies since the beggining... i can feel that,Stephan00009369
776,2021-09-29 19:40:21+00:00,1443299630691803140,@bintythabee oh them i should probably unfollow soon since i’m almost 18 ://,astrologicalsht
777,2021-09-29 19:29:57+00:00,1443297013970374666,@EXTREMEDESPAlR . . . since when do you of all people wanna do that? 😕,QxeenOfSwxmmxng
778,2021-09-29 19:29:36+00:00,1443296922354204683,"sexuality: probably 5th grade, came out as bi in 7th, came out as lesbian this year
gender: since freshman year to now https://t.co/OMQiZiPRR9",lesbiannarcy
779,2021-09-29 19:29:13+00:00,1443296827839819780,"Trans flag: Nice basic colours, tbh i think i'd like brighter colours or maybe to stray away from the whole blue and pink = boy and girl type thing but i like it!
Genderfaunet flag: Love it but i'd probably lose a couple stripes since it looks similar to the lesbian and gay flags https://t.co/nptP2LR1uh https://t.co/5dxctWrTFj",Ranboosyear
780,2021-09-29 19:27:12+00:00,1443296318038937603,@florpersephone @corvusstria Since your being polite we can have a calm discussion. Forgive me if i was rude. The lesbian lable original didnt exclude men. You dont have to like men and not all bi lesbians like men either. Bisexuality does not inherently include men or women,berry_lesbian
781,2021-09-29 19:25:35+00:00,1443295911443111942,"Elon says ""We are semi-separated but still love each other, see each other frequently and are on great terms,” and I think the love could be platonic and familial since they have a kid together but if not and if I’m wrong, then okay yeah they aren’t lesbian they’re bi",sephirothswifey
782,2021-09-29 19:09:30+00:00,1443291866724802561,"Here's what that cafard de Macédonie born 4/30/1974 at St. Peter's Hospital in Albany, NY, USA doesn't want you to know: We haven't been friends since she came out as a LESBIAN in Boston, MA b4 9/11/01. She said,""Why do I get so many STDs as a lesbian?"" Me: ?🤷🏾‍♀️I'm strickly-dickly",supernana
783,2021-09-29 19:08:42+00:00,1443291663099736067,"@SeriouslyAmelia @chasdesu Well, it's only now getting to be the same age Yagakimi was when it got adapted, I could see it happening since it ranked decently on reader polls.",andrea_reventon
784,2021-09-29 19:04:18+00:00,1443290555488866315,"No joke, this is the most depressing fucking day I’ve had at work since starting. My SAD is gonna suck even harder this year!",JoWoCo
785,2021-09-29 18:56:42+00:00,1443288645377658891,@hourlystim not the pqrts.. reveal urself since you wanna talk shit,theyshenanigans
786,2021-09-29 18:52:06+00:00,1443287487430889474,Yesterday my mom texted me “your dads been getting cyber bullied on next door for hours now” idk what the funniest part of that sentence is but I’ve been laughing ever since.,girlsgutsgiallo
787,2021-09-29 18:51:02+00:00,1443287220211929095,"We understand that life can be hard and everyone could use a break sometimes, so why not take a breather and listen to some music? Today we are highlighting an LGBTQ+ artist, Hayley Kiyoko. Hayley identifies as lesbian, and since coming out has been an advocate for LGBTQ+ rights. https://t.co/xnhOGsnoi1",BanConTherapyKy
788,2021-09-29 18:32:03+00:00,1443282441565708288,@Kaneisha_KK @BTS_twt since they couldn't do a proper mots tour i feel like these would definitely be on the setlist,K00LESBIAN
789,2021-09-29 18:25:05+00:00,1443280688975958021,"@katjetson I think it just existed in a digital form, which we have since lost. However, I def included one of the articles in a later zine with my friends called Ninja Grrrl Times, which exists at Barnard, the Lesbian Herstory Archives, &amp; my parents’ house. I’ll try to track down a copy!",rachelcorbman
790,2021-09-29 18:21:41+00:00,1443279830846517248,ok last leg of writing today since i have to play hardware store lesbian tmrw,hanabatty
791,2021-09-29 18:18:56+00:00,1443279138404642821,"@QueerTransFemme Then should we stop calling gay people gay, since the word ""gay"" was once, and is still used as an insult against homosexuals? Or does context actually matter?",LesbianCatQueen
792,2021-09-29 18:18:35+00:00,1443279053520183299,"@tumblr @photomatt @jeffdonof Anyway, since you love hearing from me so much, I will keep trying to get you to reverse your biggest mistake. I'm in for the long haul, Tumblr staff. Be seeing you again soon! ❤️",pynkbites
793,2021-09-29 18:05:33+00:00,1443275771104178177,@Mrmysterious444 @hyunjinzita since when does ur sibling get to decide for every lesbian ever whats okay and whats not,eclipseIakes
794,2021-09-29 17:59:43+00:00,1443274304465121285,@Asbash3 not only that ppl will start to have identity crisis since it’s only based on biological sex basically saying “I can’t be a lesbian bc I’m a attracted to trans woman” that would make me bisexual which wouldn’t be a problem if it wasn’t blatantly transphobic and saying that-,yeagirliguess
795,2021-09-29 17:29:03+00:00,1443266586974900228,@tragically_ham_ literally so similar vibes i did it in my dads hospital room like “my dad is dying so you can’t be mean to me :)” and she was literally like “i’ve known since you were 12 u were either a lesbian or didn’t want to be a girl” djdkdk sjdj,catboykenobi
796,2021-09-29 17:21:32+00:00,1443264696098902021,"ok since ppl r getting mad or wtv let me word myself better,, i was referring to the glider itself and not the rewards so this tweet was not that serious and kind of just jokingly! but yes regarding the rewards im fucking mad too and i aint defending nothing 😟 mihoyo sucks",ZENINZOE
797,2021-09-29 17:20:32+00:00,1443264442398093321,@clubsapnap June/july of last year actually. Impressive since i didn't know what the word lesbian meant until a few months before,shan_LVJY
798,2021-09-29 17:17:27+00:00,1443263666443497474,"@DcrlinqYang I totally support, im Lesbian but my family can’t know since they are religious. I know its bad lying to your parents but I actually came out 1 1/2 years ago and they were close to kicking me out. (Please don’t lie to anyone but still be yourself!) 🤍✨🏳️‍🌈",xxrinxx_
799,2021-09-29 17:06:46+00:00,1443260977194090497,@Steady_Squirrel @br00t4lism yeah np. I'm gonna go ahead and wager that the 24 hour thing I saw was probably from an experiment that since has been discredited/refused since this kind of stuff isn't sanctioned afaik (violates ethics rules).,Lesbian_Lenin
800,2021-09-29 16:49:19+00:00,1443256586714198017,"@finnn_lt7 i don’t think the first person who made the joke meant any harm since it’s just a play of words but it is weird that people still use it, It’s gotten old. Also, there’s already a huge stigma against the word lesbian and people always try to find other words to use instead",Peridgeo
801,2021-09-29 16:41:49+00:00,1443254699084247042,@HoopsRobyn I came out in 2017 and have been single since. In that time I have been catfished and ghosted a lot. I still have not had my first kiss yet and in 8 days I will be turning 27. This trans lesbian just wants to be loved.,emmathelady
802,2021-09-29 16:23:11+00:00,1443250011517734918,@kysccalamity Y’all been acting different to Drake ever since he said he was a lesbian… it’s giving homophobia https://t.co/eIwSwOwIkv,AJsayshey
803,2021-09-29 16:09:10+00:00,1443246484519010311,cant believe since ive been a lesbian my nails have grown thats so out of character,anyagron
804,2021-09-29 16:05:55+00:00,1443245667397275651,"anyways
spiritual karma isnt real but when you do good you percieve the world better than what it once was which must have already been pretty nice since you were willing to help it in the first place.
Karma is enlightenment, not a given

have the best day ever",DezasterLesbian
