,Datetime,Tweet Id,Text,Username
0,2021-10-05 10:31:07+00:00,1445335735482007556,DANGEROUS is India’s 1st Lesbian Crime/Love/Action film since the honourable Supreme Court repealed section 377 ..Trailer releasing in 1 hour at 5 pm https://t.co/zvj2dOJ47J,RGVzoomin
1,2021-10-05 10:25:41+00:00,1445334371590938628,"@bourbonbun I hope it's Sora or Neku for my friend Cat's sake, genuinely glad Dante was deconfirmed since Bayonetta basically fills that niche while being cooler and a lesbian",RancidSlime
2,2021-10-05 10:14:43+00:00,1445331610782605313,"@Lou_lalicorne The fact is, before today, I was unaware of the existence of people like you, as what you experience is very rarely talked about. Of course, since non-binary lesbians are under the same lesbian umbrella, you too probably fall under the same umbrella.",SunelaGoldencat
3,2021-10-05 10:14:21+00:00,1445331517320933390,@LadyDStepOnMe Yeah I haven’t been able to watch a stream without hot spotting since the 30th,MaddiesALesbian
4,2021-10-05 10:11:36+00:00,1445330824195362818,okay for 1. if you aren’t lesbian shut the fuck up 2. you have no right to speak since you aren’t lesbian 3. you shouldn’t keep bringing this up if you aren’t lesbian since it ISNT your place. https://t.co/uyVlytFgXB,SootDaydreams
5,2021-10-05 08:24:57+00:00,1445303987788464131,"killed at 6 times the rate of non-Indigenous women; women who identify as lesbian or bisexual are 3-4 times more likely than heterosexual women to report spousal violence; and 6,000+ women &amp; children sleep in shelters at night because it isn’t safe at home.

Since the outbreak—",Divine_fxminine
6,2021-10-05 08:09:02+00:00,1445299980575588353,"@lanky_lesbian This shit made me laugh so hard, if a dude can give himself head he’s the best thing since sliced bread, but if he gets head from another dude it’s WW3",SethKetchem
7,2021-10-05 08:00:11+00:00,1445297753626710017,"2021 QUEER ICON: Since he was the Times' first out LGBTQIA+ Op-Ed columnist in 2016, he has received the Randy Shilt Award for his lifetime dedication to LGBTQIA+ equality from the National Lesbian and Gay Journalists Association. Read More: https://t.co/6tlSJvpx6p 
#InterPride https://t.co/uB066dwYqs",InterPride
8,2021-10-05 07:57:44+00:00,1445297137454092289,kaeya has srsly had beef with amber since she was like FOURTEEN. he is a grown man,sharkprn
9,2021-10-05 07:23:04+00:00,1445288413612150784,"@CaliburPosting @Chan14Z Since nonbinary identities are out of the binary they can fit under any sexuality depending on who you like! Though of course, not all nonbinary people who like women exclusively will feel comfortable using the lesbian label 😊 Hope this clears it up a little.",nbylesbianOTD
10,2021-10-05 06:33:49+00:00,1445276020685381637,"so i was at a friends house the other night and my sister said she's thought i was bi or lesbian since she was 9 and my friend goes ""yeah me too you seem into women."" and i was like ""😅what makes you guys say that"" +",karlssweater
11,2021-10-05 06:14:20+00:00,1445271116029759489,"@JKNetwork1 Mashima has been hinting at them alot, Those 2 are very close. They do have good moments together. But it is kind of a mystery since they are robots and we don't know how they feel about each other. Obviously Ivry is a lesbian because she likes Rebecca and Witch. Makes Sense🤔",NathanHandy2
12,2021-10-05 05:59:11+00:00,1445267304699162636,"@UntoNuggan Me and the lesbian girl then dated the next year, 7th grade, and have been together since. She supports me fully as I work my way through my transition (FTM) and is hands down the best thing to have ever happened to me.",ArtsyDorkasaur1
13,2021-10-05 05:28:12+00:00,1445259506649387013,I have literally everything since birth and forever and on my own thoroughly and this is my daddy only and my princess holy bible only and my Illuminati blood only and Madison beer is just a thorough to the core lesbian and that is all,avvarhodeisrael
14,2021-10-05 05:07:50+00:00,1445254381889335298,@REDLICT0R Like legit mihoyo literally told the fans what was up since the first gun girlz opening. They wore that lesbian flag with pride lol,Garyt237
15,2021-10-05 05:01:39+00:00,1445252823453683712,"@AmberAudra Yeah, it definitely freaked me out. I haven’t had a movie do that to me since Sinister.",Lesbihonestx3
16,2021-10-05 04:51:46+00:00,1445250335329505281,"@Stephanovv oh lesbian energy possess me..! 

I only remember like one artist here who drew very great fem lawlu but they went on priv and haven't been active since may ;;w;;",aquam0n1ca
17,2021-10-05 04:41:56+00:00,1445247862724567040,Showed my irl lesbian weeb friend a Pic of me for the first time since we havent seen eachother since before the Pandemic and all she Responded with was this https://t.co/MMV5BaIRFP,Heyy_Mona
18,2021-10-05 04:41:34+00:00,1445247771146137601,"about me .+*
~ ky
~ they/it/void/bun
~ lesbian 
~ minor
~ diagnosed with ADHD and depression 
~ been sh-ing since 11yo",xxeshx
19,2021-10-05 04:33:00+00:00,1445245615018024960,did u guys know that since im a lesbian i hate alllllll men?,hannah_h46
20,2021-10-05 04:26:43+00:00,1445244033631203329,"@kgb__official @Karl_Was_Right It makes perfect sense. Because goods are made in China, China will be better off since they have the capacity to produce what they need. Countries dependent on imports *from* China will be screwed.",JeepLesbian
21,2021-10-05 04:17:52+00:00,1445241807437246469,I knew my dad would be tight when I came out to him ever since he was mad that I was playing a lesbian on tv 💀,TheLocDon
22,2021-10-05 04:14:57+00:00,1445241073756868609,"@Christi23525197 @gobeheroes Aw, buddy, it’s just one lesbian, but we picked the best lesbian to represent us and upset you. ✊🏼 Hey, have you seen the two awesome guys dancing together on @bbcstrictly? Maybe you’ll enjoy them too, since you can’t get enough of same-sex dance partners. 😘",FlippyO
23,2021-10-05 04:09:17+00:00,1445239646179495946,"Sakurai has said that tomorrow's announcement  is going to be a celebration of gaming. Makes sense. Ever since Sonic &amp; Snake joined the battle in Brawl, Smash has gone from being just a celebration of Nintendo, to being a celebration of the gaming industry as a whole.",theLesbianGem
24,2021-10-05 04:06:24+00:00,1445238920787103753,"@bakuangst maybe you /are/ omni, if ur attracted to any genders, since comphet is a lesbian thing",kat_uski
25,2021-10-05 03:46:29+00:00,1445233907687956484,@p1nchemarimacha Butch lesbians saved my life in 1978. I have lived every day since with one by my side. ❤❤❤💖😘😘,EchoesLesbian
26,2021-10-05 03:31:57+00:00,1445230250741305350,IVE BEEN A LESBIAN SINCE 2020?? well fuck https://t.co/VG5mgbX2bC,kat_uski
27,2021-10-05 03:07:37+00:00,1445224127883890690,"1 admin She/her Lesbian (🌺)
mostly headcanons
A MlM and WlW duo every day
If you wanna be an admin DM me
Comissions open!
Gays and lesbians are best friends since the begining of times!",MlMandWlW
28,2021-10-05 03:06:19+00:00,1445223801659314180,days since goyim non-lesbians spoke over a jewish lesbian : zero https://t.co/vDS8ZHYDL3,systemofgays
29,2021-10-05 03:00:00+00:00,1445222209056878594,"some people: ""kiana isn't a lesbian!!"" // ""mihoyo are homophobic and will never have rep!!""

kiana (the poster child for mihoyo since 2011) canon dialogue be like: https://t.co/TB3bieGRY3",yachifumis
30,2021-10-05 02:52:06+00:00,1445220223351656449,it's been a year since i started ffxiv....thank u for playing with me my friends 💕 https://t.co/aQRanInuaL,lmcfleury
31,2021-10-05 02:51:18+00:00,1445220020393426946,please my mom just describe her lesbian friend so funny “ so she lives with her best friend since 2010 thats cool right?” MOM THEYRE LOVERS AND GAY,stuckyholmes_
32,2021-10-05 02:44:46+00:00,1445218375261724674,"@go_yohaniee @_owlwitch identities don’t exist for you to understand, they exist for individuals to feel comfortable and explain their attraction/gender. i don’t fully understand bi/pan lesbian, but i also don’t feel the need to hate since a good faith identity doesn’t harm anyone.",PinkieSpirit
33,2021-10-05 02:31:20+00:00,1445214994153545737,crying about how much i love yoi since the 5th year anniversary is tomorrow… can’t believe i’ve been with it since day 1,shoumelove
34,2021-10-05 01:52:44+00:00,1445205280543936512,@lesbian_mothman yOu!!! jean as in blue jeans you’re probably the most exciting and interesting person i’ve ever spoken with. i relate to you since day 1 and i feel like we’ve known each other since i was a kid. i wake up everyday excited knowing i have someone like YOU to count on. i love you ❤️,catr4wifey
35,2021-10-05 01:46:10+00:00,1445203630471192580,"and I told her “I don’t think I know anyone who’s gay or lesbian” and she was like “oh; you do 😅”.

I’d say I was about 4-5, but obviously I was having positive exposure and interactions with lgbtq+ folks since I was a baby but had just never been given the vocab to label them",yeehawyibo
36,2021-10-05 01:38:23+00:00,1445201672314236932,One year since coming out as a lesbian!! I have grown so much :-)) https://t.co/0LesqRCLnU,pocketlesbo
37,2021-10-05 01:21:45+00:00,1445197484817408004,"Or, since it doesn't say main character, I could very easily say Tails of Eggman",RadiantGlaceon
38,2021-10-05 01:14:46+00:00,1445195727836049410,"""best paint scorer since Shaq"" btw 🌚",yfkskylah
39,2021-10-05 01:01:35+00:00,1445192409193893891,@blkdenji i think u deleted ur reply but i just wanted to say this ^^ im assuming ur not a lesbian since ur carrd says unlabelled(?) but yea https://t.co/J8kR7oa2OR,iHugGirls
40,2021-10-05 00:55:33+00:00,1445190889249333249,ok but why did this post make me feel bad since ik i’m a lesbian??? https://t.co/QJ6chE2DoG,iKissDoja
41,2021-10-05 00:54:31+00:00,1445190630758445057,Me trying to figure wtf happened on Instagram and Twitter today since I was doing homework for 6 hours straight 🤡✨ https://t.co/8uWD5eUu6y,katerooos
42,2021-10-05 00:52:06+00:00,1445190021473087493,"@prettprettyboy i wasn't aware that i had a notable twinkle since you'd known me. that... that's quite flattering, honestly",FleetingMadness
43,2021-10-05 00:48:38+00:00,1445189152031531008,"People were out in our family since I remember. Gay uncles, lesbian and trans cousins. I was out fairly young. 1988 or so? Everyone was punk and loud and loving and dying. https://t.co/NxW5zBczD0",RoxyRocketeer
44,2021-10-05 00:41:24+00:00,1445187332248834056,When you get to see your chaotic lesbian student in person for the first time since March 2020; 🤣😭🤣,operalicious
45,2021-10-05 00:26:59+00:00,1445183703685099524,"lesbian relative(At first glance, I didn't recognized her cause I was. you know... vibing around) staring at me in awe after seeing my unorthodox hairstyle cause it stood out from the crowd and since its been 5 months since I came out as queer. I saw her face again but this time-",TheG0ldenHerald
46,2021-10-05 00:20:17+00:00,1445182017054801926,Raiders under lightning delay meanwhile I’m jealous of LA for getting rain. It’s been so long since the Bay Area saw any.,KayLamb510_
47,2021-10-05 00:03:01+00:00,1445177672892665858,Ever since I saw the theory that Jack is supposed to actually be a woman and that Rose is a lesbian I've actually liked this movie https://t.co/Px3Oym0zWE,MlLFSEY
48,2021-10-04 23:50:35+00:00,1445174540477374465,"@NguyenLuce @FemboyAspergers @liberalJew1 @gewoonzim @Nataschi_ *top-on-bottom violence

ftfy since I’m not a bottom, unlike Gustaf",Tankgorl
49,2021-10-04 23:31:26+00:00,1445169722295730178,haven’t been on since fall ish 2019 so it could’ve gotten better !! but i doubt it,rosetampon
50,2021-10-04 23:15:33+00:00,1445165725891637252,I don't want the love I romantized since I was little anymore I just wanna be alone forever,LesbianHippy
51,2021-10-04 22:44:16+00:00,1445157851182292993,"Never knew league of legends had a followin of lesbian fan artists and writers. Ain't played since like 2015 and unless the game got deleted and rebuilt as a gay single player story quest, ain't goin back",RustDyke
52,2021-10-04 22:38:57+00:00,1445156514809909252,"Since the American president was a lesbian Arab ruler who defended the rights of the countries that were placed in the cage of accusations in order to take a right from him and did not respond with the answer of George Bush the father, the execution of a group of martyrs whose",_fir_20
53,2021-10-04 22:24:03+00:00,1445152767107010573,"I loved Twice's More and More since the very first second of its release and I still do, I don't care about people who hate it and honestly? if you hate it that's kinda homophobic because this song plays in lesbian heaven and if you don't like it, you're not invited/hjk",dommie_pl
54,2021-10-04 22:20:35+00:00,1445151894003986434,"@stanningsos My cousins that I’m close with call me a lesbian, like they still do to this day 🤡 and since I haven’t figured it all out atm I’m like you never know",louisismybean
55,2021-10-04 22:08:36+00:00,1445148879024967689,@Vale24616 When they cast Katie then they saw her character as a lesbian which she isnt but since Katie has played some lesbian they fancast her as a lesbian in all the roles. They are not well,Michael35979733
56,2021-10-04 22:04:49+00:00,1445147923172319234,STOP BC I JUST FOUND OUT that a junior has had a crush on me since sophomore yr and he was talking to my friend about me but my friend had to tell him that I’m a lesbian and he said “I didn’t think I would have a chance anyways”. NO CUZ THAT LOWKEY MADE ME FEEL BAD,sseolalove
57,2021-10-04 21:30:19+00:00,1445139242460618756,"hi #lesbitwt #lesbiantwt #gaytwt 

this account is about spreading positivity for all types of lesbians (excluding mspec) since a lot of counts are just centered around posting bigotry.

this is meant to be a safespace and it would mean a lot if you guys rted this so lesbians see https://t.co/rdciiUA9W0",lespositivityy
58,2021-10-04 21:19:23+00:00,1445136490468683791,@bisotd Sapphic is a lesbian term???? Since when??,mlmcolorsdaily
59,2021-10-04 21:14:48+00:00,1445135336166801410,since every other app is down everyone watch my cute tiktok  https://t.co/jQRY3rOeCr,femmecowboy
60,2021-10-04 21:13:08+00:00,1445134920322633730,"@JerryUhila @CaptAnaugi she's still in there; the comic this image is based on was made before the game came out and players learned Samus was female but since this was an official Nintendo published work considered canon to the games they made Samus Lesbian.
Nintendo accidentally being woke in 1986",Wolffang7191
61,2021-10-04 21:12:24+00:00,1445134733596250119,Wild since it turned out later my grandmother had been an out lesbian since before I was born,ofthesunless
62,2021-10-04 21:08:30+00:00,1445133753651810308,"Since Instagram is still down, watch my new lesbian vampire themed music video 🥰🕷 

https://t.co/VbHgFynx39 https://t.co/9x1HRZJiD5",FionaVodkaa
63,2021-10-04 21:05:58+00:00,1445133113244352523,"@baalbfandlover A lot of new players aren’t built for ranked dw I was there too

Players try harder, players play their mains etc I wouldn’t hold it against you since you’ve only been playing since May",yfkskylah
64,2021-10-04 21:05:31+00:00,1445133001981976587,"Since I got the Pfizer my eyes turned violet, I lost all my body hair below the neck, and I’ve not had a period https://t.co/eMWtDvNBQD",whatiscosplay
65,2021-10-04 21:04:43+00:00,1445132800865312768,i was planning on watching one horror film a day for this october since it's spooky month but i didn't stick to my plan sigh,seafoamtears
66,2021-10-04 20:58:49+00:00,1445131314789855232,@Sal_qt istg if someone cancels yall for this they can stfu coz they probably dont know anything about your religions. I am a lesbian myself and i have no issue with yall not supporting me and others who are apart of the community as long as you all respect us since we are still people,celestixal
67,2021-10-04 20:58:11+00:00,1445131154265452546,@yurirando @PomoThug @Dataport2020 Methylphenidate’s been a lifesaver for me since grade school.,SixArmedSweater
68,2021-10-04 20:51:59+00:00,1445129595611648000,"@Stoic_Slut Says you!

Wait — since when do ya have that tail. . ?",QxeenOfSwxmmxng
69,2021-10-04 20:51:07+00:00,1445129378103451659,@daisydes_ Right lol like uh you was not with me every morning. Haven’t even tweeted since 2019,MyLesbianAss
70,2021-10-04 20:41:29+00:00,1445126953309249537,haven't used facebook since i was 16 lmao deactivated and all,muumiyayya
71,2021-10-04 20:38:58+00:00,1445126319763755010,might actually have to read since so many apps are down,lesbian4horror
72,2021-10-04 20:38:38+00:00,1445126237828042753,TWITTER reminded me how many pregnant lesbians there are or lesbian since day one but 2 kids,Dj_Scarface
73,2021-10-04 20:38:27+00:00,1445126189253791744,Also since everyone is here i can complain about my day i was talking with a girl about going to a gay bar but when she found out that iam bi and not lesbian she turned me down not in a nice way like the fact that only got hate from gay ppl for being bi makes me so fcking angry,Y00NGUGH
74,2021-10-04 20:31:39+00:00,1445124479684943873,"Since Facebook &amp; Instagram are down, how about checking out my Ao3 and read some fanfics? o3o
https://t.co/ySBh6LtTWQ",Nightworldlove_
75,2021-10-04 20:27:55+00:00,1445123538994831363,Oh so since IG down people really on Twitter 😒🙄,MyLesbianAss
76,2021-10-04 20:26:32+00:00,1445123190842437643,"@KOK0Mll it’s so annoying when ppl assume you’re cishet just bc u ship a f/m ship like,,,, hello since when does gender dictate if a ship is good or not? unless the characters have specific sexualities (like a character being gay / lesbian) it’s free real estate! saying this as a lesbian",luminecity
77,2021-10-04 20:26:08+00:00,1445123089138962439,"@gorousoloss @antarticwils not defending just clarifying, i also Hope u r a Lesbian since ur mentioning this /nm",duckyecs
78,2021-10-04 20:22:48+00:00,1445122252291379201,@pubbyrot Yea I'm not saying you can't use the sunset or similar flags: just making ppl aware of the aurora lesbian flag since ik there are prob a lot of ppl uncomfortable with using anything similar to Emily's,aboredsapphic
79,2021-10-04 20:16:25+00:00,1445120643868020738,What sucks is since they shut AOL down a few years ago I can’t even go kill time in the lesbian chat rooms during times like these.,Gregggyboy
80,2021-10-04 20:13:31+00:00,1445119917024481285,what if i just do a revive on my old marvel blog since everything is going down,entropystay
81,2021-10-04 20:11:18+00:00,1445119357219180544,"@gahye0nie …is lesbians attracted to men, who have been part of lesbian community and culture since the identity was first adopted.",tharook
82,2021-10-04 20:09:55+00:00,1445119008508874763,since we all might not see e/o again lets confess things: i am not actually a lesbian,AkuX_x
83,2021-10-04 19:56:38+00:00,1445115664612667400,my acc has been locked ever since that day https://t.co/88XNfIN1D0,TeteLesbian
84,2021-10-04 19:56:11+00:00,1445115552549199872,"Since Sims 4 eats up all my time, so I offer this summary of my Sims clique of friends (including two lesbian fuck buddies and their friend who sleeps with people for all the wrong reasons and ends up getting pregnant every time) for content™ https://t.co/oKA2OzSmaQ",CruelisB
85,2021-10-04 19:56:07+00:00,1445115536174723074,since we about to die i am not a lesbian it was a joke  https://t.co/J1myzuwPfl https://t.co/vy7EY2K5Zp,andfuckvmin
86,2021-10-04 19:56:02+00:00,1445115517363130368,"What I said before is true. The County of Lane is a self admitted Eugene dominated Lesbian Socialist society since the 1970's. They will not tolerate others that speak out against them, Stenography or otherwise, they will destroy your life and family and income and call you crazy",StenographyHous
87,2021-10-04 19:50:56+00:00,1445114232874409992,"Every year since I've gotten older, around this time I've always wondered if my *obsession* with flannel shirts just makes me a straight up lesbian. I mean I do find men attractive but like...

👇🏻 https://t.co/gzTZUewfrB",thepauperpoet28
88,2021-10-04 19:23:46+00:00,1445107395210924037,"@prudhocj @faeryfancier @Melete @deaflibertarian Calm yourself before you have a stroke, old man. If the heart is kept pumping through CPR &amp; O2 is provided, it's possible. Since it was a baby the brain could rewire any damage IF it existed. It's happened before. Some of these kids have CP but most don't. https://t.co/3VymszPGBY",CMoppet
89,2021-10-04 19:23:27+00:00,1445107315963797517,Multiple lesbians thought of the same design bc frankly the combo flag idea isn't super original since its taking from former flags (the butch and lipstick lesbian flags) plus the need to have a simplified easy-to-print flag! I'll link a good source thread on this below: [2/5],pubbyrot
90,2021-10-04 19:20:15+00:00,1445106512096071692,Ever since this lesbian left my life my life been goin downhill on gang,Travis_Xantana
91,2021-10-04 19:10:10+00:00,1445103973657088016,"@bobposting share one room, no doubt

ever since I slept beside Marissa and then came back home I miss that feeling of sleeping beside the girl I love most in this world and I don't sleep as well anymore 🥺",Tankgorl
92,2021-10-04 18:48:26+00:00,1445098504880283651,"Well, so the first time I remember it clicking--to a degree, since they misgendered him, introducing me to the word ""lesbian"" in the process--was a magazine article about Brandon Teena. I'm not entirely sure which one. I was 9 when he died, so I must have been 9 or 10. Oof. https://t.co/1uRUlXupve",sequenturtle
93,2021-10-04 18:41:33+00:00,1445096769252114434,@sukufushist @bpdtooru hmmm no I don't think I will since you're so dead set on ignoring lesbian experiences of comphet. block me if you're so pissed about me sharing my comphet stories. quit misinterpreting what comphet is bc I promise you no lesbian wants to willingly sleep with a man,nixlovebot
94,2021-10-04 18:39:35+00:00,1445096276614389762,@cut4rules @CHAOSMAXINE Well I would I mostly see it as lesbian making up for their lack of attraction to real men with fictional ones if that makes since. For me I wouldn't. I personally don't see myself with a guy anytime soon,RiotChaos_
95,2021-10-04 18:33:43+00:00,1445094800982745100,"@SundaySkylar Yeah, that's like the only way I can text my family since I live overseas from them now :\",psyemocon
96,2021-10-04 18:32:41+00:00,1445094538553462790,I love *checks notes* calling the doctor and begging for help. Totally normal health care system we have here. I've been trying since high school to get my sleeping problems sorted. I'm 25.,realBRANDname
97,2021-10-04 18:22:21+00:00,1445091939561398273,"@quatoria Uhh I'm genx and I've been online since before online existed :)

But yeah. We've been dealing with creepers even before the web existed. MUDs have had their fair share of groomers and creeps.

Not wanting to dredge that up again but we have receipts on it all.",ManateeHare
98,2021-10-04 18:18:15+00:00,1445090908463042566,@sapphicfiles Is there a lot of lesbian scenes or are they Main characters? I have to ask since I don’t like to watch a ‘not gay’ movies/series,lapetitebadmeow
99,2021-10-04 18:16:26+00:00,1445090451317526538,"Yeah yeah I know it's just ONE chapter but like I was already interested in the gang, Lancer, and the like from chapter1

I guess I just don't find her characterization that appealing since Ralsei is kinda her+cuter (just without the nervous shy lesbian aspect)",SappySappster
100,2021-10-04 18:13:02+00:00,1445089595008458764,My mom knew I was a lesbian since middle school which is over 5 years before I knew and she couldn't even tell me???? This is sick,vampyrrprincess
101,2021-10-04 17:55:19+00:00,1445085134227709954,@avasalvarez well gays can’t drive and since you’re the lesbian god you’re even gayer and that’s why you can’t even ride a bike,leofitzmarryme
102,2021-10-04 17:40:10+00:00,1445081324918878209,I think its great that all these corporations that donate to her. don't worry that the republican right doesn't black list them since she is a lesbian. maybe Miller has a deep seated wish to watch a few lesbians going at it. most strait guys do. https://t.co/bJz2uGpeM6,Cherry3142today
103,2021-10-04 17:35:13+00:00,1445080078099025926,"I believe this tryst/gambit was invented &amp; concocted by lecherous bent duplicitous Sgt Martinez who, after wheeling dealing &amp; getting this girl a job &amp; fucking her in his cop car pushed the envelope &amp; since he also helped the lesbian become a cop he rolled the dice &amp; https://t.co/1fFSSXT8XU",PhilipCournoye3
104,2021-10-04 17:34:32+00:00,1445079907587985418,"@UntoNuggan Millennial - but only the L, G &amp; T - and pretty much since birth? 

My mother was a musician and had tons of lesbian and gay friends and colleagues, as well as a few who were trans, but I didn't see positive bi and nonbinary representation until 5 and 2 years ago, respectively.",cymbrygirl
105,2021-10-04 17:30:17+00:00,1445078834785685505,@hydroxyIs Since it’s based on India im terrified about them making a weird caste metaphor 😔,agenderyuri
106,2021-10-04 17:25:43+00:00,1445077687505068033,"@brigadam @PeterTatchell Trans women are female people. Trans women lesbians have been in the lesbian community since before you were born. Bigoted lesbians don't have a right to demand minority women and their partners are driven from lesbian community spaces

Tories don't have a point",RozeMalfunction
